{
  "manifest_version": "v1",
  "authority": "rust_operator_catalog",
  "owner": "apps/accel-rust",
  "source_inputs": [
    "apps/accel-rust/src/operator_catalog_data.rs",
    "apps/accel-rust/src/operators/workflow/engine.rs"
  ],
  "operators": [
    {
      "operator": "aggregate_pushdown_v1",
      "version": "v1",
      "domain": "transform",
      "source_module": "misc_ops",
      "published": false,
      "workflow_exposable": true,
      "desktop_exposable": false,
      "direct_http_only": false,
      "internal_only": true,
      "capabilities": {
        "streaming": false,
        "cache": false,
        "checkpoint": false,
        "io_contract": false
      }
    },
    {
      "operator": "aggregate_rows_v1",
      "version": "v1",
      "domain": "analytics",
      "source_module": "operators.analytics",
      "published": false,
      "workflow_exposable": true,
      "desktop_exposable": false,
      "direct_http_only": false,
      "internal_only": true,
      "capabilities": {
        "streaming": false,
        "cache": false,
        "checkpoint": false,
        "io_contract": false
      }
    },
    {
      "operator": "aggregate_rows_v2",
      "version": "v2",
      "domain": "analytics",
      "source_module": "operators.analytics",
      "published": false,
      "workflow_exposable": true,
      "desktop_exposable": true,
      "direct_http_only": false,
      "internal_only": false,
      "capabilities": {
        "streaming": false,
        "cache": false,
        "checkpoint": false,
        "io_contract": false
      }
    },
    {
      "operator": "aggregate_rows_v3",
      "version": "v3",
      "domain": "analytics",
      "source_module": "operators.analytics",
      "published": false,
      "workflow_exposable": true,
      "desktop_exposable": true,
      "direct_http_only": false,
      "internal_only": false,
      "capabilities": {
        "streaming": false,
        "cache": false,
        "checkpoint": false,
        "io_contract": false
      }
    },
    {
      "operator": "aggregate_rows_v4",
      "version": "v4",
      "domain": "analytics",
      "source_module": "operators.analytics",
      "published": true,
      "workflow_exposable": true,
      "desktop_exposable": true,
      "direct_http_only": false,
      "internal_only": false,
      "capabilities": {
        "streaming": false,
        "cache": false,
        "checkpoint": false,
        "io_contract": true
      }
    },
    {
      "operator": "anomaly_explain_v1",
      "version": "v1",
      "domain": "intelligence",
      "source_module": "platform_ops.intelligence",
      "published": true,
      "workflow_exposable": true,
      "desktop_exposable": true,
      "direct_http_only": false,
      "internal_only": false,
      "capabilities": {
        "streaming": false,
        "cache": false,
        "checkpoint": false,
        "io_contract": true
      }
    },
    {
      "operator": "capabilities_v1",
      "version": "v1",
      "domain": "governance",
      "source_module": "governance.contracts",
      "published": true,
      "workflow_exposable": true,
      "desktop_exposable": true,
      "direct_http_only": false,
      "internal_only": false,
      "capabilities": {
        "streaming": false,
        "cache": false,
        "checkpoint": false,
        "io_contract": true
      }
    },
    {
      "operator": "chart_data_prep_v1",
      "version": "v1",
      "domain": "analysis",
      "source_module": "analysis_ops",
      "published": false,
      "workflow_exposable": true,
      "desktop_exposable": true,
      "direct_http_only": false,
      "internal_only": false,
      "capabilities": {
        "streaming": false,
        "cache": false,
        "checkpoint": false,
        "io_contract": false
      }
    },
    {
      "operator": "cleaning",
      "version": null,
      "domain": "transform",
      "source_module": "cleaning_runtime",
      "published": false,
      "workflow_exposable": false,
      "desktop_exposable": false,
      "direct_http_only": false,
      "internal_only": true,
      "capabilities": {
        "streaming": false,
        "cache": false,
        "checkpoint": false,
        "io_contract": false
      }
    },
    {
      "operator": "columnar_eval_v1",
      "version": "v1",
      "domain": "platform",
      "source_module": "platform_ops.streaming",
      "published": true,
      "workflow_exposable": true,
      "desktop_exposable": true,
      "direct_http_only": false,
      "internal_only": false,
      "capabilities": {
        "streaming": false,
        "cache": false,
        "checkpoint": false,
        "io_contract": true
      }
    },
    {
      "operator": "compute_metrics",
      "version": null,
      "domain": "transform",
      "source_module": "cleaning_runtime",
      "published": false,
      "workflow_exposable": true,
      "desktop_exposable": false,
      "direct_http_only": false,
      "internal_only": true,
      "capabilities": {
        "streaming": false,
        "cache": false,
        "checkpoint": false,
        "io_contract": false
      }
    },
    {
      "operator": "constraint_solver_v1",
      "version": "v1",
      "domain": "analysis",
      "source_module": "analysis_ops",
      "published": false,
      "workflow_exposable": true,
      "desktop_exposable": true,
      "direct_http_only": false,
      "internal_only": false,
      "capabilities": {
        "streaming": false,
        "cache": false,
        "checkpoint": false,
        "io_contract": false
      }
    },
    {
      "operator": "contract_regression_v1",
      "version": "v1",
      "domain": "governance",
      "source_module": "governance.reliability",
      "published": true,
      "workflow_exposable": true,
      "desktop_exposable": true,
      "direct_http_only": false,
      "internal_only": false,
      "capabilities": {
        "streaming": false,
        "cache": false,
        "checkpoint": false,
        "io_contract": true
      }
    },
    {
      "operator": "diff_audit_v1",
      "version": "v1",
      "domain": "analysis",
      "source_module": "analysis_ops",
      "published": false,
      "workflow_exposable": true,
      "desktop_exposable": true,
      "direct_http_only": false,
      "internal_only": false,
      "capabilities": {
        "streaming": false,
        "cache": false,
        "checkpoint": false,
        "io_contract": false
      }
    },
    {
      "operator": "entity_extract_v1",
      "version": "v1",
      "domain": "transform",
      "source_module": "misc_ops",
      "published": false,
      "workflow_exposable": true,
      "desktop_exposable": false,
      "direct_http_only": false,
      "internal_only": true,
      "capabilities": {
        "streaming": false,
        "cache": false,
        "checkpoint": false,
        "io_contract": false
      }
    },
    {
      "operator": "entity_linking_v1",
      "version": "v1",
      "domain": "analysis",
      "source_module": "analysis_ops",
      "published": false,
      "workflow_exposable": true,
      "desktop_exposable": true,
      "direct_http_only": false,
      "internal_only": false,
      "capabilities": {
        "streaming": false,
        "cache": false,
        "checkpoint": false,
        "io_contract": false
      }
    },
    {
      "operator": "evidence_rank_v1",
      "version": "v1",
      "domain": "intelligence",
      "source_module": "platform_ops.intelligence",
      "published": false,
      "workflow_exposable": true,
      "desktop_exposable": true,
      "direct_http_only": false,
      "internal_only": false,
      "capabilities": {
        "streaming": false,
        "cache": false,
        "checkpoint": false,
        "io_contract": false
      }
    },
    {
      "operator": "explain_plan_v1",
      "version": "v1",
      "domain": "execution",
      "source_module": "execution_ops",
      "published": false,
      "workflow_exposable": true,
      "desktop_exposable": true,
      "direct_http_only": false,
      "internal_only": false,
      "capabilities": {
        "streaming": false,
        "cache": false,
        "checkpoint": false,
        "io_contract": false
      }
    },
    {
      "operator": "explain_plan_v2",
      "version": "v2",
      "domain": "governance",
      "source_module": "governance.planning",
      "published": true,
      "workflow_exposable": true,
      "desktop_exposable": true,
      "direct_http_only": false,
      "internal_only": false,
      "capabilities": {
        "streaming": false,
        "cache": false,
        "checkpoint": false,
        "io_contract": true
      }
    },
    {
      "operator": "fact_crosscheck_v1",
      "version": "v1",
      "domain": "intelligence",
      "source_module": "platform_ops.intelligence",
      "published": false,
      "workflow_exposable": true,
      "desktop_exposable": true,
      "direct_http_only": false,
      "internal_only": false,
      "capabilities": {
        "streaming": false,
        "cache": false,
        "checkpoint": false,
        "io_contract": false
      }
    },
    {
      "operator": "failure_policy_v1",
      "version": "v1",
      "domain": "governance",
      "source_module": "governance.contracts",
      "published": true,
      "workflow_exposable": true,
      "desktop_exposable": true,
      "direct_http_only": false,
      "internal_only": false,
      "capabilities": {
        "streaming": false,
        "cache": false,
        "checkpoint": false,
        "io_contract": true
      }
    },
    {
      "operator": "feature_store_v1_get",
      "version": null,
      "domain": "analysis",
      "source_module": "analysis_ops",
      "published": false,
      "workflow_exposable": true,
      "desktop_exposable": true,
      "direct_http_only": false,
      "internal_only": false,
      "capabilities": {
        "streaming": false,
        "cache": false,